{
  "id": "mech.mad-cat-mk-ii.2",
  "chassis": "Mad Cat Mk II",
  "model": "2",
  "figure": "bt-mad-cat-mk-ii",
  "tonnage": 90,
  "techBase": "Clan",
  "stock": true,
  "engine": { "type": "xl", "rating": 360 },
  "movement": { "walk": 4, "run": 6, "jump": 3 },
  "heatSinks": { "count": 13, "type": "double" },
  "structure": { "type": "endoSteel" },
  "armor": {
    "type": "ferroFibrous",
    "front": { "HD": 9, "CT": 38, "LT": 26, "RT": 26, "LA": 27, "RA": 27, "LL": 34, "RL": 34 },
    "rear": { "CT": 12, "LT": 8, "RT": 8 }
  },
  "crits": {
    "HD": ["lifeSupport", "sensors", "cockpit", "armor", "sensors", "lifeSupport"],
    "CT": ["engine", "engine", "engine", "gyro", "gyro", "gyro", "gyro", "engine", "engine", "engine", "#jj1", "structure"],
    "LT": ["engine", "engine", "#jj2", "#ssrm4-lt", "#ssrm4-lt2", "#erml-lt", "#ammo-ssrm4-lt", "#ammo-lb20-slug-lt", "#ammo-lb20-clu-lt", "structure", "armor", "armor"],
    "RT": ["engine", "engine", "#jj3", "#ssrm4-rt", "#ssrm4-rt2", "#erml-rt", "#ammo-ssrm4-rt", "#ammo-gauss-rt", "#ammo-gauss-rt2", "structure", "armor", "armor"],
    "LA": ["shoulder", "upperArm", "#lb20-la", "#lb20-la", "#lb20-la", "#lb20-la", "#lb20-la", "#lb20-la", "#lb20-la", "#lb20-la", "#lb20-la", "armor"],
    "RA": ["shoulder", "upperArm", "#gauss-ra", "#gauss-ra", "#gauss-ra", "#gauss-ra", "#gauss-ra", "#gauss-ra", "armor", "empty", "empty", "empty"],
    "LL": ["hip", "upperLeg", "lowerLeg", "foot", "structure", "structure"],
    "RL": ["hip", "upperLeg", "lowerLeg", "foot", "structure", "structure"]
  },
  "mounts": [
    { "id": "jj1", "item": "cl.eq.jump-jet", "location": "CT", "tons": 2 },
    { "id": "jj2", "item": "cl.eq.jump-jet", "location": "LT", "tons": 2 },
    { "id": "ssrm4-lt", "item": "cl.w.streak-srm-4", "location": "LT" },
    { "id": "ssrm4-lt2", "item": "cl.w.streak-srm-4", "location": "LT" },
    { "id": "erml-lt", "item": "cl.w.er-medium-laser", "location": "LT" },
    { "id": "jj3", "item": "cl.eq.jump-jet", "location": "RT", "tons": 2 },
    { "id": "ssrm4-rt", "item": "cl.w.streak-srm-4", "location": "RT" },
    { "id": "ssrm4-rt2", "item": "cl.w.streak-srm-4", "location": "RT" },
    { "id": "erml-rt", "item": "cl.w.er-medium-laser", "location": "RT" },
    { "id": "lb20-la", "item": "cl.w.lb-20x", "location": "LA" },
    { "id": "gauss-ra", "item": "cl.w.gauss-rifle", "location": "RA" }
  ],
  "ammoBins": [
    { "id": "ammo-ssrm4-lt", "ammo": "cl.ammo.streak-srm-4", "location": "LT" },
    {
      "id": "ammo-lb20-slug-lt",
      "ammo": "cl.ammo.lb-20x-slug",
      "location": "LT",
      "options": ["cl.ammo.lb-20x-slug", "cl.ammo.lb-20x-cluster"]
    },
    {
      "id": "ammo-lb20-clu-lt",
      "ammo": "cl.ammo.lb-20x-cluster",
      "location": "LT",
      "options": ["cl.ammo.lb-20x-slug", "cl.ammo.lb-20x-cluster"]
    },
    { "id": "ammo-ssrm4-rt", "ammo": "cl.ammo.streak-srm-4", "location": "RT" },
    { "id": "ammo-gauss-rt", "ammo": "cl.ammo.gauss-rifle", "location": "RT" },
    { "id": "ammo-gauss-rt2", "ammo": "cl.ammo.gauss-rifle", "location": "RT" }
  ],
  "bv": 2822,
  "source": {
    "ref": "megamek",
    "note": "Mad Cat Mk II 2 MTF (mm-data 3067 Unabridged/Clan Meks) cross-check; BV from MUL",
    "retrieved": "2026-10-08"
  },
  "valueSources": { "/bv": {"ref": "mul", "note": "2822 (MUL, 2026-10-08)"} },
  "verify": [
    {
      "path": "",
      "note": "stock Mad Cat Mk II 2 standing in for the box's second Mad Cat Mk II variant, whose stats are not public",
      "status": "standIn"
    },
    {
      "path": "/crits",
      "note": "slot order follows the MegaMek record, not a printed record sheet",
      "status": "unconfirmed"
    },
    {
      "path": "/quirks",
      "note": "MTF quirks dropped in release 1 (imp_target_med)",
      "status": "unconfirmed"
    }
  ]
}
